video_id,trending_date,title,channel_title,category_id,publish_time,tags,views,likes,dislikes,comment_count,thumbnail_link,comments_disabled,ratings_disabled,video_error_or_removed,description
HO3pl7Wtn-w,18.14.01,"Ơn Giời Cậu Đây Rồi | Tập 7 Full: Quân Sư Trường Giang đổ mồ hôi, vật vã vì Đức Phúc",Ơn giời cậu đây rồi,24,2018-01-13T16:15:21.000Z,"thank god you’re here|""thank god you are here""|""satellite tv provider""|""cable television companies""|""cable providers""|""cable packages""|""cable company in my area""|""tv cable companies""|""cable tv provider""|""cable television providers""|""satellite tv providers""|""cable provider""|""cable service providers""|""ơn giời cậu đây rồi""|""on gioi cau day roi""|""ogcdr""|""hoài linh""|""chí tài""|""trường giang""|""xuân bắc""|""việt hương""",2285434,26877,1221,4292,https://i.ytimg.com/vi/HO3pl7Wtn-w/default.jpg,FALSE,FALSE,FALSE,"Kênh YOUTUBE CHÍNH THỨC của chương trình Ơn Giời Câu Đây Rồi\n\nChương trình “Ơn giời! Cậu đây rồi!” (Thank God! You’re here) là một chương trình hài tình huống đầu tiên tại Việt Nam do công ty Đông Tây Promotion phối hợp với Đài Truyền hình Việt Nam thực hiện. Bản quyền thuộc Fremantle Media.\n\nĐây là chương trình giải trí hài chưa đựng nhiều yếu tố hấp dẫn, hào hứng trong từng phút, từng khoảnh khắc. Khán giả sẽ thấy các thí sinh (là những nghệ sĩ nổi tiếng) bị đẩy vào vào tình huống mà bản thân họ không biết trước mình là ai, diễn như thế nào và những gì sắp sửa diễn ra sau cánh cửa.\n\nThank God You're Here is an Australian television improvised comedy program created by Working Dog Productions, which premiered on Network Ten on 5 April 2006, and aired for the first three seasons and on Seven for the fourth season. Each episode involves performers walking through a door into an unknown situation, greeted by the line Thank God you're here!”. They then had to improvise their way through the scene. At the end of each episode a winner was announced. It was the most successful new show in Australia of 2006, attracting an average of 1.7 million viewers after the first few episodes."
Zz1yNu2QLlg,18.14.01,북한에도 유튜브하나? 김정은 개인채널도 있나? [ 공대생네 가족 ],공대생네 가족,24,2018-01-13T11:42:40.000Z,"공대생|""공대생네""|""공대생가족""|""공대생할머니""|""韩国""|""Corea""|""del""|""Sur""|""韓国""|""Corée""|""du""|""Sud""|""이경자""|""경자76""|""할머니유튜브""|""공대생엄마""|""이경자할머니""|""경자할머니""|""경자씨""|""경자""|""가족유튜브""|""유튜브가족""|""행복한""|""유튜브""|""유튜브수익""|""짱구""|""짱구는못말려""|""짱구더빙""|""김하나""|""변승주""|""변승주김하나""|""공대생김하나""|""변승주공대생""|""공대생변승주""|""신기한""|""재밌는""|""정아""|""현정숙""|""현정아""|""변종호""|""공대생아빠""|""공대생아버지""|""공대생어머니""|""유튜브수입""|""비디오빌리지""|""비빌""|""걸스빌리지""|""공두리""|""손주""|""당일치기해외여행""|""먹방""|""korea""|""korean""|""kpop""|""김정은""|""북한유튜브""|""김정은유튜브""",163621,4904,62,3020,https://i.ytimg.com/vi/Zz1yNu2QLlg/default.jpg,FALSE,FALSE,FALSE,안녕하세요 여러분들 공대생네에 오신걸 환영합니다!!! (짝짝짝)\n이 채널은 우주최강 깜직이 할머니 이경자 할머니와 공대생 가족들이 만들어 나가는 똥꼬발랄한 채널입니다\n할머니에게 많은 추억을 안겨드리고 싶어서 만들었고 재미있는 영상 많이 찍을테니까 많은 관심 부탁드려요 ㅎㅎ 사랑합니다\n\n 메일은 hjsbjh2@naver.com 으로 주세요!
8reDkKEbmZQ,18.14.01,(옹녤환황영) 워너원 이즈 뷰티풀 | 강다니엘 너무 바쁜데,다닉쓰 남팬 켈빈 Kelvin,24,2018-01-13T05:12:16.000Z,"프로듀스 101 시즌 2|""Wanna One""|""워너원""|""나야 나""|""강다니엘""|""Kang Daniel""|""Produce 101 Season 2""|""Music""|""K-POP""|""Korea""|""K-pop Memes""|""J-Pop""|""Japan""|""J-rock""|""Variety Show""|""Korean Variety Show""|""케이팝""|""음착""|""K-pop""|""fanboy""|""BTS Fan""|""Seventeen Fan""|""Got7 Fan""|""EXO Fan""|""KNK Fan""|""NCT Fan""|""Vixx fan""|""BAP Fan""|""Produce 101 Fan""|""Infinite fan""|""Astro fan""",25705,415,3,22,https://i.ytimg.com/vi/8reDkKEbmZQ/default.jpg,FALSE,FALSE,FALSE,DISCLAIMER: ALL RIGHTS RESERVED TO RESPECTIVE OWNERS.\n\nWatch Again the episodes of Produce 101 Season 2:\nhttp://onair.mnet.com/produce101/sub/vod2\n\n---------------------------------------------------------------------------------------------\n#Produce101 #Produce101Season2 #프로듀스101 #프로듀스101시즌2 #プロヂュス１０１ #プロヂュス１０１シジュン２ #WannaOne #워너원 #옹성우 #박지훈 #박우진 #김재환 #라이관린 #배진영 #황민현 #윤지성 #하성운 #이대휘 \n--------------------------------------------------------------------------------------------\n-----------------------------------------------------------------------------------------------\n #강다니엘#KangDaniel\n-----------------------------------------------------------------------------------------------\n\nSUBSCRIBE to the channel for more videos. Thank you.
aaM-UHSOMkI,18.14.01,김동률 - 사랑한다 말해도(Feat.이소라),Muzic Cue,22,2018-01-11T09:43:12.000Z,"김동률|""사랑한다 말해도""|""이소라""|""감성""|""kpop""",97389,975,13,106,https://i.ytimg.com/vi/aaM-UHSOMkI/default.jpg,FALSE,FALSE,FALSE,김동률 - 사랑한다 말해도 (Feat.이소라)
6R2bY2mvuGY,18.14.01,"집값 잡겠다고? 강남선 “노무현정부 시즌2” 콧방귀..국토부 답변은 황당 그자체,,시장혼란  가속도,,",도봉박홍기,25,2018-01-13T10:28:00.000Z,[none],29562,1476,68,209,https://i.ytimg.com/vi/6R2bY2mvuGY/default.jpg,FALSE,FALSE,FALSE,우리 은행  (대동포럼)    박 홍기       후원계좌 1005 - 203 - 205878   \n                         \n10만원 이상은 정중하게 사절 합니다.\n\nhttp://weekly.donga.com/List/3/all/11/98758/1\n\n\nhttp://bizn.donga.com/realestate/East/3/all/20171220/87828429/1\n\n\nhttp://news.joins.com/article/22230936\n\n\nhttp://cafe456.daum.net/_c21_/recent_bbs_read?grpid=1OaUj&fldid=Mhu3&page=1&prev_page=0&contentval=000bYzzzzzzzzzzzzzzzzzzzzzzzzz&datanum=2328&regdt=20180107180844&listnum=20\n\n\nhttp://news.kbs.co.kr/news/view.do?ncd=494457\n\nhttp://www.yeongnam.com/mnews/newsview.do?mode=newsView&newskey=20180109.010160759310001
wQ_POfToaVY,18.14.01,TWICE「Candy Pop」Music Video,TWICE JAPAN OFFICIAL YouTube Channel,10,2018-01-11T15:00:03.000Z,"TWICE|""Candy Pop""",8667619,348383,22081,46403,https://i.ytimg.com/vi/wQ_POfToaVY/default.jpg,FALSE,FALSE,FALSE,"TWICE JAPAN 2nd SINGLE『Candy Pop』\n2018.02.07 Release！\nhttps://twicejapan.lnk.to/cDBPDAY!D\n\n『Candy Pop』発売\n○CD収録曲\n01「Candy Pop」\n02「BRAND NEW GIRL」　※LINE「Clova Friends 双子ダンス篇」CMソング\n03「Candy Pop (Instrumental)」\n04「BRAND NEW GIRL (Instrumental)」\n\n○初回限定盤A　WPZL-31403/4\n価格￥1,852（＋税）\nCD＋DVD＋24p歌詞ブックレット＋トレーディングカード(10種からランダムで1枚)\nDVD収録内容： \n「Candy Pop」Music Video\n「Candy Pop」Music Video Making Movie\n  \n○初回限定盤B　WPZL-31405/6\n価格￥1,713（＋税）\nCD＋DVD＋トレーディングカード(10種からランダムで1枚)\nDVD収録内容：\n「Candy Pop」Music Video Dance ver.\nJacket Shooting Making Movie\n\n○通常盤　WPCL-12820\n価格￥1,204（＋税）\nCD＋トレーディングカード(10種からランダムで1枚)\n※トレーディングカードは初回プレス分のみ封入\n\n○ONCE JAPAN限定盤　WPCL-12821\n価格￥1,389（＋税）\nCD+チェンジングジャケット9枚+応募シリアルナンバー封入\n※バレンタイン仕様チェンジングジャケット9枚 (ソロ写真ジャケット×9人分) 封入\n※ONCE JAPAN限定盤はTWICEオフィシャルファンクラブ“ONCE JAPAN”会員、もしくは「ONCE JAPAN MOBILE」会員の方が購入できる会員限定商品です。\n\n○WARNER MUSIC DIRECT限定セット（特典BOX付きCD3形態セット）\n価格￥4,769（＋税）\n「Candy Pop」の【初回限定盤A】(WPZL-31403/04)、【初回限定盤B】(WPZL-31405/06)、【通常盤】(WPCL-12820)のCD3形態に、特製収納BOXを特典として付属した、WARNER MUSIC DIRECT限定のセット商品。\n\nhttp://www.twicejapan.com/"
Ot7XRw0BJ84,18.14.01,날유의 알앤비도전기,쇠똥구리,24,2018-01-12T09:13:25.000Z,"유재석|""유희열""|""김조한""",291184,3379,71,268,https://i.ytimg.com/vi/Ot7XRw0BJ84/default.jpg,FALSE,FALSE,FALSE,
KY4DuVJ_Xsw,18.14.01,18년1월13일 위키 폭로로 중도층에게도 재평가받는 박대통령 업적들,나라애 tv,22,2018-01-13T13:32:56.000Z,"개성공단폐쇄|""개성공단""",40150,3491,33,343,https://i.ytimg.com/vi/KY4DuVJ_Xsw/default.jpg,FALSE,FALSE,FALSE,"개성공단 임금 북괴정권이 98% 착복했다고 폭로한 위키리크스에의해,개성공단폐쇄는 신의한수라며, 박대통령에 대한 중도층의인식이 변화되고 있음을 소개합니다.아울러,\n영화보며 눈물이나 찔찔 흘리는 감성팔이 쇼정치로는 민심얻기 힘들겁니다."
zV9hev0t5ko,18.14.01,[마루에몽]이거 수출되면 안되는데....,TV ONE,22,2018-01-12T09:24:44.000Z,"마루에몽|""수출""",139397,471,18,176,https://i.ytimg.com/vi/zV9hev0t5ko/default.jpg,FALSE,FALSE,FALSE,
G7DeYku3xW0,18.14.01,"🔴설마 했던 진짜 MB 배후를 폭로했다 , 자유한국당 큰일 났다 박영선 홈런",충이슈,25,2018-01-13T04:00:00.000Z,[none],69622,499,82,148,https://i.ytimg.com/vi/G7DeYku3xW0/default.jpg,FALSE,FALSE,FALSE,"진짜 MB 배후를 폭로했다 , 자유한국당 큰일 났다 박영선 홈런"
Bn-2aJONSb4,18.14.01,BLACKPINK - ‘블핑하우스 (BLACKPINK HOUSE)’ EP.2-1,BLACKPINK,22,2018-01-13T12:00:03.000Z,"BLACKPINK|""블랙핑크""|""블핑""|""제니""|""리사""|""로제""|""지수""|""JENNI""|""LISA""|""JISOO""|""ROSÉ""",861401,50518,285,2970,https://i.ytimg.com/vi/Bn-2aJONSb4/default.jpg,FALSE,FALSE,FALSE,"‘블핑하우스 (BLACKPINK HOUSE)’ EP.2ㅤ\n\n[Online release & On-air]\nSAT. 9PM(KST): YouTube, V LIVE\nSUN. 10AM(KST): JTBC2 \n\n#블핑하우스 #BLACKPINK_HOUSE #BLACKPINK\n\nMore about BLACKPINK @\nhttp://www.blackpinkofficial.com/\nhttp://www.facebook.com/BLACKPINKOFFICIAL\nhttp://www.youtube.com/BLACKPINKOFFICIAL\nhttp://www.instagram.com/BLACKPINKOFFICIAL\nhttp://www.twitter.com/ygent_official"
rA6Wc-Qq57I,18.14.01,레드벨벳의 집밥 먹방 (슬기와 조이의 폭풍 먹방),레드벨벳라인,24,2018-01-13T01:30:30.000Z,"레드벨벳|""레드벨벳 리얼리티""|""레드벨벳 레벨업 프로젝트""|""레벨업 프로젝트""|""레벨업 프로젝트 시즌2""|""슬기""|""조이""|""레드벨벳 먹방""|""먹방""",414349,3931,75,502,https://i.ytimg.com/vi/rA6Wc-Qq57I/default.jpg,FALSE,FALSE,FALSE,
odDFvnt0NN0,18.14.01,신년기자회견에서 핫한 기자 3인방!!!그들의 숨길수 없는 과거!!!!,H. TV,25,2018-01-10T09:28:52.000Z,"h.tv|""Htv""|""신년기자회견""|""기자회견""|""기자""|""기레기""|""최지원""|""박정엽""|""성현희""|""조선""|""과거""|""문재인""|""대통령""|""청와대""|""신년""|""좃선""|""좃선일보""|""조선일보 기레기""",226288,2909,229,686,https://i.ytimg.com/vi/odDFvnt0NN0/default.jpg,FALSE,FALSE,FALSE,"오늘 문프님의 기자회견에서 \n기자들과 즉석 질의 응답이 화제입니다.\n특히,몇 몇 기자들의 질문 내용과 태도가\n뜨거운 감자인데요~\n그들의 핫한 소식들을 \n모아~모아~봤습니다.\n이 영상을 기자들이…싫어라 할까요~~??ㅎㅎ"
s0otcIsq7kI,18.14.01,멜론차트 1월 2주차(2018.01.11),소다의이모저모,24,2018-01-11T15:32:39.000Z,"#듣기좋은 노래|""#노래""|""#멜론""|""#멜론차트""|""#공부할때 좋은 노래""|""#라이브""|""#멜론방송""|""#멜론라이브""|""#지니뮤직""|""#멜론최신차트""|""#소다""",152056,558,74,70,https://i.ytimg.com/vi/s0otcIsq7kI/default.jpg,FALSE,FALSE,FALSE,"오늘 제외된 노래는 겨울소리, koko bop 입니다"
bpHSwYol6W8,18.14.01,"[18/01/12 뉴스투데이] 일일 기상캐스터 조세호, 이 시각 여의도역…'최강 한파'",먼저다사람이,25,2018-01-11T23:07:13.000Z,"조세호|""일일 기상캐스터""|""최강한파""|""MBC""|""뉴스투데이""|""조세호 기상캐스터""",74861,311,12,95,https://i.ytimg.com/vi/bpHSwYol6W8/default.jpg,FALSE,FALSE,FALSE,"이 영상의 저작권은 MBC에 있습니다.\n\n많은 분들이 영상 보실 수 있도록 좋아요, 구독 부탁드립니다. 채널 운영에 도움이 됩니다.\nTo subscribe our channel or like our video"
hscN7eYYLeo,18.14.01,"[리플] 아이돌 슈퍼주니어 프리미엄 콜라를 마셔보았다! 슈퍼주니어 프리미엄 소다,콜라 리뷰! | Ripp",Ripple_S,23,2018-01-13T11:02:54.000Z,"임프|""임프레드""|""IMP""|""서영""|""미나""|""민욱""|""마태""|""진아""|""여름""|""석준""|""석준여름""|""마태진아""|""미나민욱""|""리플""|""리플에스""|""리플레이""|""RIPPLE""|""RIPPLE_S""|""여자""|""연애""|""남자""|""상담""|""심리""|""리뷰""|""imp_red""|""red""|""리플스""|""성인""|""레드박스""|""남녀""|""소다""|""스파클링""|""콜라""|""프리미엄콜라""|""슈퍼주니어""|""피코크""|""SM""",201453,3160,55,834,https://i.ytimg.com/vi/hscN7eYYLeo/default.jpg,FALSE,FALSE,FALSE,[Contents Awesome!]\n\n리플의 꿀잼 영상이 계속 올라옵니다!\n좋아요와 구독버튼 눌러주세요♥\n\n\n★더 다양한 리플을 만나보세요★\nRipple_S Facebook :: https://goo.gl/3YJc2N\nRipple_F instagram :: https://goo.gl/rlN17l\nRipple instagram :: https://goo.gl/ggi6Ql\n\n\n\n- Ripple Company Business mail\n:: company.ripple@gmail.com
k5TqNsr6YuQ,18.14.01,Troye Sivan - My My My!,TroyeSivanVEVO,10,2018-01-11T05:00:01.000Z,"troye sivan|""troye""|""my my my""|""official""|""music video""|""new song""",5144910,420502,8490,35712,https://i.ytimg.com/vi/k5TqNsr6YuQ/default.jpg,FALSE,FALSE,FALSE,"“My My My!” available now: https://TroyeSivan.lnk.to/MyMyMyID\n \nDIRECTOR – Grant Singer\nPRODUCER – Saul Germaine\nEXECUTIVE PRODUCER – Nina Soriano\nEDITOR – Nick Rondeau\nPRODUCTION COMPANY – Anonymous Content\n \nLYRICS:\nShine on.  Diamond \nDon’t make me wait another day\nCause passion is passion,\nYou know it just as well as me\n \nNow let's stop running from love \nRunning from love\nLet’s stop, my baby\nLet’s stop running from us\nRunning from us  \nLet’s stop, my baby\n \nOh my my my!\nI die every night with you\nOh my my my!\nLiving for your every move\n \nSpark up.  \nBuzz cut\nI got my tongue between your teeth\nGo slow.  No, no go fast \nYou like it just as much as me\n \nNow let's stop running from love\nRunning from love\nLet’s stop, my baby\nLet’s stop running from us\nRunning from us\nLet’s stop, my baby\n \nOh my my my!\nI die every night with you\nOh my my my!\nLiving for your every move\n \nShould be the last night ever\nShould be the last night we’re apart\nGot my name on this treasure\nOn this treasure\n \nOh my my my!\nI die every night with you\nOh my my my!\nLiving for your every move\n \nFollow me!\nhttp://www.troyesivan.com\nhttp://www.twitter.com/troyesivan\nhttp://www.youtube.com/troye\nhttp://www.instagram.com/troyesivan\nhttp://www.facebook.com/troyesivan\nhttp://www.troyesivan.tumblr.com\n \n© 2018 Universal Music Australia Pty Ltd.\n\nhttp://vevo.ly/la9RGY"
D1hUltEysIw,18.14.01,한 여자가 외진 섬마을에 들어가 경험한 일들,드림텔러(DreamTeller),10,2018-01-13T09:22:16.000Z,[none],176650,1175,76,964,https://i.ytimg.com/vi/D1hUltEysIw/default.jpg,FALSE,FALSE,FALSE,이 영화 보고나면 답답합니다
pqMZycDmvp8,18.14.01,친안철수 vs. 반안철수 대충돌…난장판 국민의당 당무위,NocutV,25,2018-01-12T08:38:13.000Z,"nocutV|""노컷V""|""CBS""|""스마트뉴스""|""안철수""|""당무위원회""|""통합""|""바른정당""",35667,154,4,126,https://i.ytimg.com/vi/pqMZycDmvp8/default.jpg,FALSE,FALSE,FALSE,바른정당과 통합을 위한 전당대회 준비위원회 구성 등 논의를 위해 12일 긴급 소집된 국민의당 당무위원회가 통합 찬반 양측의 격렬한 충돌로 난장판이 됐습니다.\n관련기사 - http://nocutnews.co.kr/news/4906228
wTB-YY1Wd6w,18.14.01,베이블레이드 버스트 갓 금지 개조 흡수 능력 200% 강화! 블러드 파브닐 맞을수록 강해진다!  [배틀토이],Battle Toy 배틀토이,1,2018-01-12T23:00:02.000Z,"ベイブレードバースト|""Beyblade Burst""|""베이블레이드버스트""|""장난감""|""장난감배틀""|""챌린저""|""전투팽이""|""베이블레이드""|""탑블레이드""|""탑플레이트""|""배틀토이""|""토이""|""TOY""|""장난감팽이""|""팽이""|""배틀팽이""|""3세대 배틀 팽이""|""장난감놀이""|""베이블레이드버스트 대결""|""베이블레이드버스트 대회""|""신제품 장난감 팽이""|""장난감 싸움""|""숙명의 대결""|""일본 장난감""|""금지 개조""|""흡수 능력""|""블러드 파브닐""|""드레인 파브닐""",102023,875,51,666,https://i.ytimg.com/vi/wTB-YY1Wd6w/default.jpg,FALSE,FALSE,FALSE,"장난감 대격돌 배틀토이\n베이 배틀 참여 신청은 '좋아요', '구독' 완료 후 댓글창에 레이어, 디스크, 드라이버 조합으로 신청해주세요~ 랜덤추첨됩니다~"
Lh8WNF2sVhU,18.14.01,게장 새우장 스팸계란 밥장인돼지찌개 먹방,엠브로,24,2018-01-13T14:22:39.000Z,"맛있는 먹방|""먹방""|""아프리카 먹방""|""MBRO""|""엠브로""|""엠브로 먹방""|""FOOD FIGHT""|""FOOD FIGHTER""|""푸드파이터""|""EAT""|""EATER""|""FAST EATER""|""한식""|""분식""|""양식""|""중식""|""일식""|""MUKBANG""|""여캠""|""남캠""|""아프리카""|""아프리카TV""|""BJ""|""비제이""|""pizza""|""chicken""|""피자""|""치킨""|""보쌈""|""족발""|""양띵""|""대정령""|""악어""|""대도서관""|""김이브님""|""윰댕""|""최군""|""meokbang""|""meok""|""bang""|""eat""|""food""|""cook""|""cooking""|""korean""|""korea""|""funnyvideo""|""funny""|""vlog""|""블로그""|""다이어트""|""엽떡""",62058,838,36,297,https://i.ytimg.com/vi/Lh8WNF2sVhU/default.jpg,FALSE,FALSE,FALSE,"▶ 오늘의 메뉴 : MUKBANG\n\n▶ 채널 업로드 : 채널업로드 시간 오후8-10시 , 오전 1시-2시\n\n▶INSTAGRAM : https://www.instagram.com/bj_mbro/\n\n▶아프리카TV : http://afreeca.com/mbro77\n\n▶ BJ MBRO : 아프리카 생방송 시간  11:00pm\n\n▶유튜브 채널: MBRO"
vZqdvu4xsl0,18.14.01,"Đức Phúc dạy Trường Giang cách yêu nghiêm túc, tử tế | Best Cut Ơn Giời Cậu Đây Rồi 2017",ĐÔNG TÂY PROMOTION OFFICIAL,24,2018-01-13T16:05:29.000Z,"dong tay promotion|""đông tây promotion""|""on gioi cau day roi""|""ơn giời cậu đây rồi""|""on gioi cau day roi tap 7""|""ơn giời cậu đây rồi tập 7""|""on gioi cau day roi 7""|""on""|""on gioi""|""on gioi cau""|""on gioi cau day""|""on gioi cau day roi tap 7 full""|""truong giang""|""trường giang""|""tran thanh""|""trấn thành""|""hoai linh""|""hoài linh""|""on gioi cau day roi duc phuc""|""on gioi cau day roi 2017""|""phi nhung""|""kha nhu""|""khả như""|""duc phuc""|""đức phúc""|""hoang rapper""",2083841,45695,1008,4263,https://i.ytimg.com/vi/vZqdvu4xsl0/default.jpg,FALSE,FALSE,FALSE,"on gioi cau day roi, ơn giời câu đây rồi, ơn gioi cau day roi 2017, ơn giời cậu đây rồi 2017, duc phu, đức phúc, phi nhung, tran thanh, trấn thành, truong giang, trường giang, hoai linh, hoài linh, hoang rapper\n\nĐức Phúc dạy Trường Giang cách yêu nghiêm túc, tử tế | Best Cut Ơn Giời Cậu Đây Rồi 2017\n\n⏩ Click xem ngay, show HAY mỗi ngày: http://bit.ly/showhotmoingay\n\nNhấn subcribe để xem tiếp những video tuyệt vời khác: \n\n✥ Subscribe: http://bit.ly/dtpsubs\n\n✥ Website: www.dongtay.com"
azeKSiW1kXk,18.14.01,요리하는남자 강다니엘 김치볶음밥 살려내기ㅋㅋㅋ(feat.형들 맛있는거 드려야 하니까),GIRIN PEACH,22,2018-01-13T01:03:36.000Z,"강다니엘|""kangdaniel""|""워너원""|""wannaone""|""옹성우""|""김재환""|""발칙한동거""|""발칙한동거워너원""|""발칙한동거강다니엘""|""발칙한동거김재환""|""발칙한동거옹성우""|""발칙한동거옹녤환""|""옹녤환""",43554,963,4,89,https://i.ytimg.com/vi/azeKSiW1kXk/default.jpg,FALSE,FALSE,FALSE,귀엽고 또 착하고 또 멋있고 \n그냥 강다니엘 하세요
zZOAV1jFDo4,18.14.01,사냥하러 갔다가 100마리 버팔로 한테 갇혀버린 사자들,동물들의싸움,15,2018-01-12T06:24:03.000Z,"동물들의싸움|""물소 사냥""|""버팔로 사냥""|""버팔로 싸움""|""사자 싸움""|""사자 사냥""|""사자 사냥 실패""",67296,67,6,11,https://i.ytimg.com/vi/zZOAV1jFDo4/default.jpg,FALSE,FALSE,FALSE,
GWy1yAJdDkY,18.14.01,180113 BTS - Best of Me live performance,bukishine,24,2018-01-13T11:54:16.000Z,"BTS|""방탄소년단""|""Best of Me""|""4th Muster""|""The Chainsmokers""",611263,48792,113,2756,https://i.ytimg.com/vi/GWy1yAJdDkY/default.jpg,FALSE,FALSE,FALSE,Credit: @kooktamin
D29skpaBcXM,18.14.01,여자친구 옷차림 보고.. 바로 구애댄스♥ (18.01.12 #5) Couple Video,와꾸대장봉준 (MUTUBE),23,2018-01-12T16:05:28.000Z,"봉준|""김봉준""|""와꾸대장봉준""|""무튜브""|""아프리카""|""mutube""|""Bongjun""|""철구""|""대도서관""|""감스트""|""먹방""|""아프리카tv""|""섹시""|""섹시여캠""|""여캠""|""여친""|""여자친구""|""옷차림""|""여자""|""친구""|""여친 옷차림""|""채보미""|""보미""|""봉보미""|""봉준 보미""|""봉준 채보미""",63511,0,0,78,https://i.ytimg.com/vi/D29skpaBcXM/default.jpg,FALSE,TRUE,FALSE,"★공유, 좋아요, 구독★ 한번씩만 꾹꾹! 눌러주세요~ 사랑합니다♥"
mKp_yaKmvgA,18.14.01,Ed Sheeran - Perfect ( cover by J.Fla ),JFlaMusic,10,2018-01-12T12:06:24.000Z,"perfect|""ed sheeran""|""제이플라""|""j fla""",1031997,63817,960,7509,https://i.ytimg.com/vi/mKp_yaKmvgA/default.jpg,FALSE,FALSE,FALSE,"I hope you enjoy this cover of Perfect by Ed Sheeran\n\nCheck out my new playlist on Spotify: https://open.spotify.com/user/ostereomusic/playlist/2Am93DtohuMnYmEzkyy4Y9\n\nYou can now listen to my new single on Spotify, Apple Music, Bugs, Melon, Naver, Google Play, Amazon Prime, KK Box, Deezer & more by following these links:\n\nApple Music - http://po.st/JFlaApple\nSpotify - http://po.st/JFlaSpotify\nMelon - http://po.st/JFlaMelon\nBugs - http://po.st/JFlaBugs\nNaver - http://po.st/JFlaNaver\nGoogle Play - http://po.st/JFlaGoogle\nAmazon - http://po.st/JFlaAmazon\nKK Box - http://po.st/JFlaKKBOX\nDeezer - http://po.st/JFlaDeezer\n\nDon't forget to subscribe, like and leave a comment.\n\nYouTube: http://bit.ly/2caT96b\nFacebook: http://bit.ly/2hl6FFt\nTwitter: http://bit.ly/2lzDBgt\nInstagram: http://bit.ly/1RRFc9U"
IxabOROdMns,18.14.01,[TF현장] 뱃지면 다야? 멱살잡이·고성… 난장판 된 국민의당,thefact,24,2018-01-12T08:01:59.000Z,"안철수|""통합""|""바른정당""|""유승민""|""반대파""|""유성엽""|""박지원""|""장병완""|""장정숙""",27711,75,8,66,https://i.ytimg.com/vi/IxabOROdMns/default.jpg,FALSE,FALSE,FALSE,2018년 1월 12일 바른정당 통합에 대한 전당대회 개최 관련 국민의당 당무위가 국회에서 열린 가운데  찬성파와 반대파가 대립하며 몸싸움과 고성이 오갔다.
iL2lI51vv54,18.14.01,"BBC기자 날선질문,그리고 자신의 SNS에 올린글#Laura Bicker #Anna Fified",뉴스벅,25,2018-01-10T06:33:05.000Z,"BBC기자|""신년기자회견""|""Laura Bicker""|""Anna Fified""|""BBC reporter""|""2018 문재인 기자회견""",455668,2260,461,729,https://i.ytimg.com/vi/iL2lI51vv54/default.jpg,FALSE,FALSE,FALSE,2018  문재인 대통령 신년기자회견 에서\nBBC기자 날선질문을 했다  그리고 자신의\nSNS에 올린글이 화재가 되고 누리꾼은 환호했다.\n\n-외신기자- \n로라비커 Laura Bicker 와 BBC reporter\n안나파이필드 Anna Fified 특파원
s_u6Uqdq7NI,18.14.01,"워너원(Wanna One) 강다니엘, 선미와 가시나 댄스 ㅋㅋ",SkyVideos,22,2018-01-11T18:08:44.000Z,[none],1866620,30985,716,2427,https://i.ytimg.com/vi/s_u6Uqdq7NI/default.jpg,FALSE,FALSE,FALSE,"강다니엘, 황민현, 배진영, 김재환"
1_mVtpm_8AI,18.14.01,워너비 더뮤지션 : 땡스파티 행사 스케치 영상 제2탄!,더뮤지션,22,2018-01-13T06:00:03.000Z,"더뮤지션|""워너원""|""더뮤지션워너원""|""워너비더뮤지션땡스파티. 더뮤지션워너원영상""|""wannaone""|""워너비더뮤지션영상""",15700,1286,2,75,https://i.ytimg.com/vi/1_mVtpm_8AI/default.jpg,FALSE,FALSE,FALSE,워너비 더뮤지션 : 땡스파티 현장 스케치 \n제2탄을 공개합니다!\n\n멤버들의 더뮤지션 연주 타임!\n게임 최강팀 다니엘&지훈 군의 연주 결과가 \n궁금하지 않으신가요? (･ω･)☆\n\n팀 내 최약체(?)로 지목된 대휘군이\n연주를 두 번 하게 된 사연도\n지금 영상에서 확인해보세요♥\n\n더뮤지션 하러 가기↓↓\nhttp://goo.gl/4MfuvK
